{
  "schemaVersion": 1,
  "academicYear": 2026,
  "timezone": "Asia/Tokyo",
  "source": [
    {
      "id": "official-undergraduate-2026-2q",
      "title": "Science Tokyo 2026 2Q Undergraduate final-exam timetable",
      "url": "https://www.titech.ac.jp/student/pdf/life-undergraduate-exam-timetable.pdf",
      "landingPageUrl": "https://www.titech.ac.jp/student/students/life/undergraduate-exam",
      "publishedAt": "2026-08-03",
      "retrievedAt": "2026-10-03T15:08:06+09:00",
      "sha256": "c9b45b7143eb3589f67e4aa17e5e03ac7ee476d54e426233ecd0d636af905226"
    }
  ],
  "entries": [
    {
      "id": "2026-2Q-undergraduate-2026-07-29-LAL.C202-07-001",
      "kind": "exam",
      "status": "scheduled",
      "quarter": "2Q",
      "courseCode": "LAL.C202-07",
      "date": "2026-07-29",
      "periods": [
        1,
        2
      ],
      "room": {
        "ja": "M-356"
      },
      "label": {
        "ja": "中国語初級２ C07",
        "en": "Chinese: Basic Course 2 C07"
      },
      "sourceIds": [
        "official-undergraduate-2026-2q"
      ],
      "sourcePages": [
        1
      ]
    },
    {
      "id": "2026-2Q-undergraduate-2026-07-29-LAL.C202-09-002",
      "kind": "exam",
      "status": "scheduled",
      "quarter": "2Q",
      "courseCode": "LAL.C202-09",
      "date": "2026-07-29",
      "periods": [
        1,
        2
      ],
      "room": {
        "ja": "M-B101"
      },
      "label": {
        "ja": "中国語初級２ C09",
        "en": "Chinese: Basic Course 2 C09"
      },
      "sourceIds": [
        "official-undergraduate-2026-2q"
      ],
      "sourcePages": [
        1
      ]
    },
    {
      "id": "2026-2Q-undergraduate-2026-07-29-LAL.C202-10-003",
      "kind": "exam",
      "status": "scheduled",
      "quarter": "2Q",
      "courseCode": "LAL.C202-10",
      "date": "2026-07-29",
      "periods": [
        1,
        2
      ],
      "room": {
        "ja": "W3-207"
      },
      "label": {
        "ja": "中国語初級２ C10",
        "en": "Chinese: Basic Course 2 C10"
      },
      "sourceIds": [
        "official-undergraduate-2026-2q"
      ],
      "sourcePages": [
        1
      ]
    },
    {
      "id": "2026-2Q-undergraduate-2026-07-29-LAL.F202-04-004",
      "kind": "exam",
      "status": "scheduled",
      "quarter": "2Q",
      "courseCode": "LAL.F202-04",
      "date": "2026-07-29",
      "periods": [
        1,
        2
      ],
      "room": {
        "ja": "W3-205"
      },
      "label": {
        "ja": "フランス語初級２ F04",
        "en": "French: Basic Course 2 F04"
      },
      "sourceIds": [
        "official-undergraduate-2026-2q"
      ],
      "sourcePages": [
        1
      ]
    },
    {
      "id": "2026-2Q-undergraduate-2026-07-29-LAL.F202-05-005",
      "kind": "exam",
      "status": "scheduled",
      "quarter": "2Q",
      "courseCode": "LAL.F202-05",
      "date": "2026-07-29",
      "periods": [
        1,
        2
      ],
      "room": {
        "ja": "M-143A"
      },
      "label": {
        "ja": "フランス語初級２ F05",
        "en": "French: Basic Course 2 F05"
      },
      "sourceIds": [
        "official-undergraduate-2026-2q"
      ],
      "sourcePages": [
        1
      ]
    },
    {
      "id": "2026-2Q-undergraduate-2026-07-29-LAL.G202-09-006",
      "kind": "exam",
      "status": "scheduled",
      "quarter": "2Q",
      "courseCode": "LAL.G202-09",
      "date": "2026-07-29",
      "periods": [
        1,
        2
      ],
      "room": {
        "ja": "M-B45"
      },
      "label": {
        "ja": "ドイツ語初級２ D33",
        "en": "German: Basic Course 2 D33"
      },
      "sourceIds": [
        "official-undergraduate-2026-2q"
      ],
      "sourcePages": [
        1
      ]
    },
    {
      "id": "2026-2Q-undergraduate-2026-07-29-LAL.I302-007",
      "kind": "exam",
      "status": "scheduled",
      "quarter": "2Q",
      "courseCode": "LAL.I302",
      "date": "2026-07-29",
      "periods": [
        1,
        2
      ],
      "room": {
        "ja": "M-B43"
      },
      "label": {
        "ja": "イタリア語２",
        "en": "Italian 2"
      },
      "sourceIds": [
        "official-undergraduate-2026-2q"
      ],
      "sourcePages": [
        1
      ]
    },
    {
      "id": "2026-2Q-undergraduate-2026-07-29-LAL.K302-01-008",
      "kind": "exam",
      "status": "scheduled",
      "quarter": "2Q",
      "courseCode": "LAL.K302-01",
      "date": "2026-07-29",
      "periods": [
        1,
        2
      ],
      "room": {
        "ja": "W3-201"
      },
      "label": {
        "ja": "韓国語２ a",
        "en": "Korean 2 a"
      },
      "sourceIds": [
        "official-undergraduate-2026-2q"
      ],
      "sourcePages": [
        1
      ]
    },
    {
      "id": "2026-2Q-undergraduate-2026-07-29-LAL.K302-02-009",
      "kind": "exam",
      "status": "scheduled",
      "quarter": "2Q",
      "courseCode": "LAL.K302-02",
      "date": "2026-07-29",
      "periods": [
        1,
        2
      ],
      "room": {
        "ja": "M-103"
      },
      "label": {
        "ja": "韓国語２ b",
        "en": "Korean 2 b"
      },
      "sourceIds": [
        "official-undergraduate-2026-2q"
      ],
      "sourcePages": [
        1
      ]
    },
    {
      "id": "2026-2Q-undergraduate-2026-07-29-LAL.R202-04-010",
      "kind": "exam",
      "status": "scheduled",
      "quarter": "2Q",
      "courseCode": "LAL.R202-04",
      "date": "2026-07-29",
      "periods": [
        1,
        2
      ],
      "room": {
        "ja": "W8E-308"
      },
      "label": {
        "ja": "ロシア語初級２ R04",
        "en": "Russian: Basic Course 2 R04"
      },
      "sourceIds": [
        "official-undergraduate-2026-2q"
      ],
      "sourcePages": [
        1
      ]
    },
    {
      "id": "2026-2Q-undergraduate-2026-07-29-LAL.S202-10-011",
      "kind": "exam",
      "status": "scheduled",
      "quarter": "2Q",
      "courseCode": "LAL.S202-10",
      "date": "2026-07-29",
      "periods": [
        1,
        2
      ],
      "room": {
        "ja": "S2-201"
      },
      "label": {
        "ja": "スペイン語初級２ S32",
        "en": "Spanish: Basic Course 2 S32"
      },
      "sourceIds": [
        "official-undergraduate-2026-2q"
      ],
      "sourcePages": [
        1
      ]
    },
    {
      "id": "2026-2Q-undergraduate-2026-07-29-LAL.S202-14-012",
      "kind": "exam",
      "status": "scheduled",
      "quarter": "2Q",
      "courseCode": "LAL.S202-14",
      "date": "2026-07-29",
      "periods": [
        1,
        2
      ],
      "room": {
        "ja": "S3-215"
      },
      "label": {
        "ja": "スペイン語初級２ S36",
        "en": "Spanish: Basic Course 2 S36"
      },
      "sourceIds": [
        "official-undergraduate-2026-2q"
      ],
      "sourcePages": [
        1
      ]
    },
    {
      "id": "2026-2Q-undergraduate-2026-07-29-LAE.E114-49-013",
      "kind": "exam",
      "status": "scheduled",
      "quarter": "2Q",
      "courseCode": "LAE.E114-49",
      "date": "2026-07-29",
      "periods": [
        3,
        4
      ],
      "room": {
        "ja": "M-124"
      },
      "label": {
        "ja": "英語第四 再1",
        "en": "English 4 再1"
      },
      "sourceIds": [
        "official-undergraduate-2026-2q"
      ],
      "sourcePages": [
        2
      ]
    },
    {
      "id": "2026-2Q-undergraduate-2026-07-29-LAE.E214-49-014",
      "kind": "exam",
      "status": "scheduled",
      "quarter": "2Q",
      "courseCode": "LAE.E214-49",
      "date": "2026-07-29",
      "periods": [
        3,
        4
      ],
      "room": {
        "ja": "M-124"
      },
      "label": {
        "ja": "英語第八 再1",
        "en": "English 8 再1"
      },
      "sourceIds": [
        "official-undergraduate-2026-2q"
      ],
      "sourcePages": [
        2
      ]
    },
    {
      "id": "2026-2Q-undergraduate-2026-07-29-LAL.C202-12-015",
      "kind": "exam",
      "status": "scheduled",
      "quarter": "2Q",
      "courseCode": "LAL.C202-12",
      "date": "2026-07-29",
      "periods": [
        3,
        4
      ],
      "room": {
        "ja": "M-356"
      },
      "label": {
        "ja": "中国語初級２ C12",
        "en": "Chinese: Basic Course 2 C12"
      },
      "sourceIds": [
        "official-undergraduate-2026-2q"
      ],
      "sourcePages": [
        2
      ]
    },
    {
      "id": "2026-2Q-undergraduate-2026-07-29-LAL.C202-15-016",
      "kind": "exam",
      "status": "scheduled",
      "quarter": "2Q",
      "courseCode": "LAL.C202-15",
      "date": "2026-07-29",
      "periods": [
        3,
        4
      ],
      "room": {
        "ja": "M-B101"
      },
      "label": {
        "ja": "中国語初級２ C15",
        "en": "Chinese: Basic Course 2 C15"
      },
      "sourceIds": [
        "official-undergraduate-2026-2q"
      ],
      "sourcePages": [
        2
      ]
    },
    {
      "id": "2026-2Q-undergraduate-2026-07-29-LAL.F202-06-017",
      "kind": "exam",
      "status": "scheduled",
      "quarter": "2Q",
      "courseCode": "LAL.F202-06",
      "date": "2026-07-29",
      "periods": [
        3,
        4
      ],
      "room": {
        "ja": "W3-205"
      },
      "label": {
        "ja": "フランス語初級２ F06",
        "en": "French: Basic Course 2 F06"
      },
      "sourceIds": [
        "official-undergraduate-2026-2q"
      ],
      "sourcePages": [
        2
      ]
    },
    {
      "id": "2026-2Q-undergraduate-2026-07-29-LAL.F202-07-018",
      "kind": "exam",
      "status": "scheduled",
      "quarter": "2Q",
      "courseCode": "LAL.F202-07",
      "date": "2026-07-29",
      "periods": [
        3,
        4
      ],
      "room": {
        "ja": "M-143A"
      },
      "label": {
        "ja": "フランス語初級２ F07",
        "en": "French: Basic Course 2 F07"
      },
      "sourceIds": [
        "official-undergraduate-2026-2q"
      ],
      "sourcePages": [
        2
      ]
    },
    {
      "id": "2026-2Q-undergraduate-2026-07-29-LAL.G202-13-019",
      "kind": "exam",
      "status": "scheduled",